{
  "id": "1",
  "name": "White Square",
  "description": "A white square",
  "count_views": "99",
  "count_faves": "0",
  "count_comments": "0",
  "date_taken": "2010-01-01 13:00:00",
  "count_tags": "2",
  "count_notes": "0",
  "rotation": 0,
  "date_imported": "2011-01-01 14:00:00",
  "photopage": "https://www.flickr.com/photos/test-user/1/",
  "original": "https://live.staticflickr.com/1234/1_o.jpg",
  "license": "All Rights Reserved",
  "geo": [],
  "groups": [],
  "albums": [
    {
      "id": "100",
      "title": "Test Album",
      "url": "https://www.flickr.com/photos/test-user/sets/100/"
    }
  ],
  "tags": [],
  "people": [],
  "notes": [],
  "privacy": "public",
  "comment_permissions": "any flickr member",
  "tagging_permissions": "people you follow",
  "safety": "safe",
  "comments": []
}
